{
  "record_kind": "work",
  "test_fixture": true,
  "id": "fixt-001",
  "slug": "a-fictitious-minimal-work",
  "title": "A Fictitious Minimal Work",
  "authors": [
    { "name_human": "A. Fictitious Author", "name_normalized": "Author, A. Fictitious", "is_human": true, "agent_type": "human", "orcid": "0000-0002-1825-0097" }
  ],
  "type": "working-paper",
  "status": "draft",
  "visibility": "draft",
  "language": "en",
  "doi_concept": "10.5555/example.minimal.concept",
  "licenses": [ { "spdx": "CC-BY-4.0", "label": "Creative Commons Attribution 4.0" } ],
  "versions": [
    { "id": "fixt-001-v1", "vN": "v1", "date": "2099-01-15", "doi_version": "10.5555/example.minimal.v1", "is_current": true }
  ]
}
